texto,fonte,source_url,veredito,data,image_url,tags
"Em vídeo, ministro do TSE admite que urnas foram fraudadas",AFP Checamos,https://checamos.afp.com/doc.afp.com.33P649W,FALSO,2023-07-14 07:00:00,https://encrypted-tbn0.gstatic.com/images?q=tbn:ANd9GcRPLG3DyhyLzUaLuFTp7wipW4bGSg2Cimot1oZyDsqt28FSEO7O,"['Tribunal Superior Eleitoral', 'Ministro do Tribunal Superior Eleitoral do Brasil', 'Urna eleitoral', 'Ministro', 'Vídeo']"
"Gilmar Mendes fala sobre falhas nas urnas eletrônicas, incluindo mesário pianista",Estadão,https://www.estadao.com.br/estadao-verifica/gilmar-mendes-mesario-pianista-urna-eletronica/,FALSO,2023-07-14 07:00:00,https://encrypted-tbn2.gstatic.com/images?q=tbn:ANd9GcQKqQmn1VJZExafSSPX5KRjq_yvpcyFZtJInxtfJ7N7kYRapQbX,"['Gilmar Mendes', 'Mesário', 'Urna eleitoral', 'Urna eletrônica']"
sso é grave. Ministro Cássio Nunes lê texto que revela as fr4ld3s. Explica isso TSE. Urnas adulteradas ou fraudadas,UOL Notícias,https://noticias.uol.com.br/confere/ultimas-noticias/2023/07/14/nunes-marques-nao-apontou-fraude-em-urnas-video-distorce-fala-do-ministro.htm,FALSO,2023-07-14 07:00:00,https://encrypted-tbn2.gstatic.com/images?q=tbn:ANd9GcRT3qmowjXuVxllKqdJTt3N2vjWz3rREOMchIgVDA6smhKYmrGU,"['Nunes Marques', 'Urna eleitoral', 'Ministro', 'Tribunal Superior Eleitoral', 'Texto']"
Nunes Marques disse que urnas eletrônicas foram fraudadas,Aos Fatos,https://www.aosfatos.org/noticias/video-nunes-marques-urnas-fraudadas-voto-fora-de-contexto/,FALSO,2023-07-12 07:00:00,https://encrypted-tbn0.gstatic.com/images?q=tbn:ANd9GcTduC4F4Smt99ETxr_CS9fzi00MCNNCFTeKbOW4g0g7qfmnQSnE,"['Nunes Marques', 'Urna eleitoral', 'Urna eletrônica']"
"Líder dos advogados do PT, dr. Avacalho Ellhys orienta a continuar fraudando as pesquisas e consumar nas urnas pois essa eleição ja esta ganha, eles tomarão o poder de qualquer maneira",AFP Checamos,https://checamos.afp.com/doc.afp.com.328R3FX,FALSO,2022-04-22 07:00:00,https://encrypted-tbn1.gstatic.com/images?q=tbn:ANd9GcSNoPHAb_-Tyya-_txl5Jnfb6eYovW_Q61dO7qeAYWTmujAGU3F,"['Partido dos Trabalhadores', 'Partido dos Trabalhadores', 'Urna eleitoral', 'Advogado', 'Eleição', 'Liderança', 'Poder']"
Este vídeo mostra que em 2017 o TSE era a favor do voto impresso,AFP Checamos,https://checamos.afp.com/doc.afp.com.32AA7G6,FALSO,2022-05-17 07:00:00,https://encrypted-tbn0.gstatic.com/images?q=tbn:ANd9GcQtVQAIm2XeoC_Kq9CBiyiVJ2kdQW8tIhsJx94qZq-t71w7H4W6,"['Comprovante de votação verificado pelo eleitor', 'Tribunal Superior Eleitoral', 'Votação', 'Vídeo', '2017']"
Boletim de urna encontrado na rua em Curitiba (Paraná) prova fraude de votos não contabilizados para Bolsonaro nas eleições,Boatos.org,https://www.boatos.org/politica/boletim-urna-rua-curitiba-fraude-bolsonaro.html,FALSO,2022-10-04 07:00:00,https://encrypted-tbn0.gstatic.com/images?q=tbn:ANd9GcReAoS3xVaGi98dR81FGLEHn2SC_r7y-m5t2zskwXhma47SuFpg,"['Jair Bolsonaro', 'Urna eleitoral', 'Eleição', 'Fraude', 'Votação', 'Curitiba', 'Paraná']"
"Essa alma é JIUSEPPE DUTRA JANINO, chefe do setor de T.I do SUP TRIBUNAL ELEITORAL?. Atolado até os cabelos na fraude das urnas?. Vamos deixar ele famoso?! Pediu demissão e hoje é assessor de Luís Roberto Barroso. Só isso",UOL Notícias,https://noticias.uol.com.br/confere/ultimas-noticias/2023/04/22/e-falso-que-ex-diretor-de-ti-do-tse-trabalhe-como-assessor-de-barroso.htm,FALSO,2023-04-22 07:00:00,https://encrypted-tbn1.gstatic.com/images?q=tbn:ANd9GcT_57-EKqJZwFJLFq3HoQORGTtreWahqPAsUgrJ4SBxrM0nGuLM,"['Luís Roberto Barroso', 'Giuseppe Janino', 'Tribunal Superior Eleitoral', 'Fraude nas urnas eletrônicas', 'Eleição', 'Tecnologia da informação', 'Urna eleitoral', 'Fraude', 'Tribunal', 'Demissão']"
Antonio Palocci disse que urnas eletrônicas são fraudáveis,Aosfatos.org,https://www.aosfatos.org/noticias/palocci-nao-disse-ser-possivel-fraudar-urna-eletronica/,FALSO,2020-11-24 08:00:00,,"['Antonio Palocci', 'Urna eleitoral', 'Urna eletrônica']"
Líder dos advogados do PT é gravado falando em conspiração para fraudar pesquisas eleitorais e manipular votos nas urnas eletrônicas em favor de Lula,Projeto Comprova,https://projetocomprova.com.br/publica%C3%A7%C3%B5es/advogado-do-pt-em-video-do-kwai-e-personagem-de-humor/,FALSO,2022-04-22 07:00:00,,"['Advogado', 'Partido dos Trabalhadores', 'Luiz Inácio Lula da Silva', 'Eleição', 'Partido dos Trabalhadores', 'Votação', 'Pesquisa', 'Fraude', 'Urna eleitoral']"
"Com 0,39% das urnas apuradas [nas eleições municipais de São Paulo], o sistema travou. (...) Quando o sistema voltou a funcionar lá na frente, já com quase 100% [do resultado eleitoral] apurado, a ordem dos candidatos permaneceu exatamente a mesma.",Aos Fatos,https://www.aosfatos.org/noticias/bolsonaro-promete-provas-de-fraude-mas-apresenta-alegacoes-ja-desmentidas-sobre-urnas-eletronicas/,FALSO,2021-07-29 07:00:00,,"['Urna eleitoral', 'Eleição', 'Candidato', 'Eleições municipais no Brasil', 'Sistema', 'São Paulo', 'Resultado']"
URGENTE ÁUDIO VAZADO DO DIRETOR DA DATAFOLHA MAURO PAULINO PLANO DE FRAUDES NAS URNAS,Boatos.org,https://www.boatos.org/politica/audio-de-mauro-paulino-diretor-datafolha-sobre-fraude-nas-pesquisas-vaza-na-internet.html,FALSO,2022-09-04 07:00:00,https://encrypted-tbn1.gstatic.com/images?q=tbn:ANd9GcRsQcOSDKN_NO0QpuXVy95LK9sdtDQhRIFmAtcO04rJX-u83Kpy,"['Datafolha', 'Fraude', 'Urna eleitoral']"
Áudio do major Humberto Picolino revela que eleição é teatro para intervenção e que urnas estão conectadas com sistema Starlink e quântico,Boatos.org,https://www.boatos.org/politica/major-humberto-picolino-teatro-intervencao.html,FALSO,2022-10-05 07:00:00,https://encrypted-tbn1.gstatic.com/images?q=tbn:ANd9GcRsQcOSDKN_NO0QpuXVy95LK9sdtDQhRIFmAtcO04rJX-u83Kpy,"['Eleição', 'Urna eleitoral', 'Teatro', 'Sistema']"
Urnas em Serafina Corrêa tinham 81% dos votos previamente computados para Lula,AFP Checamos,https://checamos.afp.com/doc.afp.com.32KJ2NE,FALSO,2022-10-01 07:00:00,https://encrypted-tbn2.gstatic.com/images?q=tbn:ANd9GcTZvqNO7sru7pNDCApFULmyyJXPVHHBhDmXweC7_qqB6WCgj-3y,"['Urna eleitoral', 'Votação', 'Luiz Inácio Lula da Silva', 'Serafina Corrêa']"
Presidente Bolsonaro tem provas sobre a insegurança das urnas eletrônicas. Hacker teve acesso ao código-fonte das urnas e milhares ou milhões de votos foram adulterados em 2018,Projeto Comprova,https://projetocomprova.com.br/publica%C3%A7%C3%B5es/inquerito-da-pf-nao-investiga-fraude-no-processo-de-votacao/,FALSO,2021-08-13 07:00:00,https://encrypted-tbn0.gstatic.com/images?q=tbn:ANd9GcQUZogZJ7Vm0eEN3xwtDJ6jGL3uy43PWrCfptLKkccB0m8uDYlz,"['Votação', 'Jair Bolsonaro', 'Urna eleitoral', 'Presidente', 'Urna eletrônica', 'Prova', '2018', 'Hacker', 'Eletrônica', 'Código-fonte']"
Urnas eletrônicas foram descartadas no DMLU de Porto Alegre,Aos Fatos,https://www.aosfatos.org/noticias/falso-urnas-dmlu-porto-alegre/,FALSO,2022-11-22 08:00:00,https://encrypted-tbn3.gstatic.com/images?q=tbn:ANd9GcRWuj2yL6gdYl-Ol0XlpGW8jdkuucp_JK2_GBEGHAFASnIqxFmE,"['Urna eleitoral', 'Urna eletrônica', 'Porto Alegre', 'Departamento Municipal de Limpeza Urbana']"
Polícia Federal encontrou urnas já com votos registrados,Aos Fatos,https://www.aosfatos.org/noticias/e-falso-que-policia-federal-identificou-urnas-com-votos-ja-registrados-em-brasilia/,FALSO,2022-10-01 07:00:00,https://encrypted-tbn1.gstatic.com/images?q=tbn:ANd9GcSB3qyqYEvR6LFi-XnsCKBebEtcF010YOBAPgrAwn3pATD-eNYZ,"['Departamento de Polícia Federal', 'Urna eleitoral', 'Votação', 'Polícia Federal']"
Diferenças nos logs das urnas mostram que foram usados dois software e dois códigos-fonte diferentes,Aos Fatos,https://www.aosfatos.org/noticias/site-argentino-mentiras-urna-eletronica/,FALSO,2022-11-07 08:00:00,,"['Urna eleitoral', 'Código-fonte', 'Software', 'Log de dados']"
As eleições de 2022 usaram modelos de urna antigos que não são passíveis de auditoria.,Aos Fatos,https://www.aosfatos.org/noticias/site-argentino-mentiras-urna-eletronica/,FALSO,2022-11-07 08:00:00,,"['Urna eleitoral', 'Eleição', 'Eleições presidenciais brasileiras, 2022', 'Auditoria', '2022']"
Chave dos códigos das urnas eletrônicas estão nas mãos de venezuelanos,UOL Notícias,https://noticias.uol.com.br/confere/ultimas-noticias/2020/11/02/e-falso-que-chave-para-decifrar-codigo-de-urnas-esteja-em-maos-venezuelanas.htm,FALSO,2020-11-02 08:00:00,https://encrypted-tbn1.gstatic.com/images?q=tbn:ANd9GcSKOG7RSkqxEarkdITbKSUSvm5C-1CGdyLw1vD54ZiDlUlfFYfq,"['Urna eleitoral', 'Urna eletrônica']"
"Esse é o Janino, conhecido como ""pai das urnas eletrônicas "". Comandou as urnas no TSE por 15 anos. Qdo a PF ficou na cola dele, ele foi exonerado no TSE é virou ASSESSOR do Barroso.",Boatos.org,https://www.boatos.org/politica/pai-urna-eletronica-assessor-barroso-ocupa-cargo-porque-investigado-pela-pf.html,FALSO,2021-08-11 07:00:00,https://encrypted-tbn3.gstatic.com/images?q=tbn:ANd9GcQeZpaigOpOADvVah7FNWm90wr3ytAY0gCkrQPqwvwvGAs5HRqR,"['Giuseppe Janino', 'Urna eletrônica', 'Urna eleitoral', 'Luís Roberto Barroso', 'Polícia Federal', 'Departamento de Polícia Federal', 'Tribunal Superior Eleitoral', 'Exoneração']"
URGENTE: A invasão hacker do TSE revela a fraude nas urnas com a chancela da justiça eleitoral.,Boatos.org,https://www.boatos.org/politica/ataque-hacker-revela-fraude-urnas-eletronicas.html,FALSO,2020-11-16 08:00:00,https://encrypted-tbn3.gstatic.com/images?q=tbn:ANd9GcQeZpaigOpOADvVah7FNWm90wr3ytAY0gCkrQPqwvwvGAs5HRqR,"['Fraude nas urnas eletrônicas', 'Hacker', 'Tribunal Superior Eleitoral', 'Urna eleitoral', 'Eleição']"
A urna eletrônica pode ser hackeada; os resultados das eleições podem ser hackeados,UOL Notícias,https://noticias.uol.com.br/confere/ultimas-noticias/2020/10/01/eleicoes-2020-a-urna-eletronica-pode-ser-hackeada.htm,FALSO,2020-10-01 07:00:00,https://encrypted-tbn3.gstatic.com/images?q=tbn:ANd9GcQsPBG3CVTxaCL7pBsaFMuhXLJ55TSIj1pHCtgfOS4Qcd9trKYx,"['Máquina de votação', 'Urna eleitoral', 'Eleição', 'Eletrônica']"
URNAS FORAM ENCONTRADAS DESCARTADAS ILEGALMENTE NO DMLU DE PORTO ALEGRE,Boatos.org,https://www.boatos.org/politica/urnas-eletronicas-descartadas-ilegalmente-porto-alegre-mostra-foto.html,FALSO,2022-11-23 08:00:00,https://encrypted-tbn3.gstatic.com/images?q=tbn:ANd9GcQeZpaigOpOADvVah7FNWm90wr3ytAY0gCkrQPqwvwvGAs5HRqR,"['Urna eleitoral', 'Porto Alegre', 'Departamento Municipal de Limpeza Urbana']"
Mesários podem anular seu voto na urna eletrônica,AFP Checamos,https://checamos.afp.com/doc.afp.com.32J277T,FALSO,2022-09-09 07:00:00,https://encrypted-tbn1.gstatic.com/images?q=tbn:ANd9GcQHVJwrgt7FNmP_yZg_BHMT9BpmYvAa2ZseeRip6K5hwBMHAAHQ,"['Mesário', 'Votação', 'Urna eleitoral', 'Máquina de votação', 'Eletrônica']"
Código-fonte das urnas eletrônicas não é auditável,UOL Notícias,https://noticias.uol.com.br/confere/ultimas-noticias/2022/09/16/pequeno-dicionario-do-processo-eleitoral.htm,FALSO,2022-09-16 07:00:00,https://encrypted-tbn0.gstatic.com/images?q=tbn:ANd9GcRJuE7hrSUvyGAwA2TdspZEXMMzXOu7o1XMtKiitYhNFYHogTBp,"['Urna eleitoral', 'Urna eletrônica', 'Código-fonte']"
Militar responsável pela auditoria das urnas eletrônicas foi morto a caminho do aeroporto,Aos Fatos,https://www.aosfatos.org/noticias/militar-morto-campinas-nao-integrava-grupo-de-fiscalizacao-tse/,FALSO,2022-11-10 08:00:00,https://encrypted-tbn3.gstatic.com/images?q=tbn:ANd9GcSRLS0mKrA-kxJdGNC5-jAxuCG70u7bclV1G5t1tLsq0CejrMyK,"['Urna eleitoral', 'Militar', 'Urna eletrônica', 'Morte', 'Auditoria', 'Aeroporto']"
Policiais militares encontraram urna eletrônica fraudada no Distrito Federal,Aos Fatos,https://www.aosfatos.org/noticias/e-falso-que-policiais-militares-encontraram-urna-eletronica-fraudada-no-distrito-federal/,FALSO,2020-10-23 07:00:00,https://encrypted-tbn3.gstatic.com/images?q=tbn:ANd9GcSU8be2WofxHCn6Zejvrx3zJBEJY64878xRRyflvjfRnYVmdSIt,"['Fraude', 'Urna eleitoral', 'Máquina de votação', 'Polícia', 'Forças armadas', 'Polícia militar', 'Brasília', 'Eletrônica']"
"ITA e IME, institutos militares, fizeram protótipo de urnas para voto impresso, mas foram vetados pelo TSE (Tribunal Superior Eleitoral)",UOL Notícias,https://noticias.uol.com.br/confere/ultimas-noticias/2020/10/22/ita-ime-urnas-voto-impresso-tse.htm,FALSO,2020-10-22 07:00:00,https://encrypted-tbn3.gstatic.com/images?q=tbn:ANd9GcRxNlQJpC50ByOxLNYW9mbLZOIr8qBHz4-G6Wk7pH3NWDY6wz-N,"['Comprovante de votação verificado pelo eleitor', 'Urna eleitoral', 'Tribunal Superior Eleitoral', 'Votação', 'Eleição', 'Veto', 'Instituto Tecnológico de Aeronáutica', 'Instituto Militar de Engenharia', 'Tribunal', 'Protótipo']"
"Em um áudio que circula no WhatsApp, um homem afirma que os eleitores que pretendem votar no ex-presidente Lula devem ir às urnas no dia 3 de outubro (segunda-feira), e não no dia 2 de outubro (domingo), para evitar conflitos com eleitores que votarão em Bolsonaro.",Folha - UOL,https://www1.folha.uol.com.br/poder/2022/10/todos-os-brasileiros-votam-em-2-de-outubro-ao-contrario-do-que-diz-post.shtml,FALSO,2022-10-01 07:00:00,https://encrypted-tbn1.gstatic.com/images?q=tbn:ANd9GcQuVb68lXPTvz7lHGyiGoYrlecGTVHw8lpiIdTR79gMC1jqPiiJ,"['Votação', 'Eleição', 'Presidente', 'Outubro', 'Luiz Inácio Lula da Silva', 'Jair Bolsonaro', 'Dia', 'Urna eleitoral']"
"SEJA UM FISCAL NA APURAÇÃO - O ""Você Fiscal"" é um aplicativo que permite a qualquer eleitor fiscalizar a transmissão de resultados da urna em que votou, registrando o Boletim de Urna (BU) ao fim da eleição na sua Zona Eleitoral. Baixe o aplicativo e contribua + transparência!",Boatos.org,https://www.boatos.org/tecnologia/aplicativo-voce-fiscal-diego-aranha-vai-ser-utilizado-eleicoes-de-2022.html,FALSO,2022-10-01 07:00:00,https://encrypted-tbn1.gstatic.com/images?q=tbn:ANd9GcRsQcOSDKN_NO0QpuXVy95LK9sdtDQhRIFmAtcO04rJX-u83Kpy,"['Eleição', 'Aplicativo móvel', 'Urna eleitoral', 'Eleitor', 'Zona eleitoral']"
"7,2 milhões de votos foram anulados pelas urnas nas eleições de 2018.",Aos Fatos,https://www.aosfatos.org/noticias/e-falso-que-72-milhoes-de-votos-foram-anulados-pelas-urnas-na-eleicao-de-2018/,FALSO,2020-09-28 07:00:00,https://encrypted-tbn3.gstatic.com/images?q=tbn:ANd9GcQovW4ZcyAkOglD61wQNln4bV_cnY7zRIENdcICK0DtvcQxrp03,"['Votação', 'Eleição', 'Urna eleitoral', 'Eleições presidenciais brasileiras, 2018', '2018']"
"Mas a tecnologia da mesma [urna eletrônica], a sua segurança, quase nada mudou de lá [dos anos 1990] para cá.",Aos Fatos,https://www.aosfatos.org/noticias/bolsonaro-promete-provas-de-fraude-mas-apresenta-alegacoes-ja-desmentidas-sobre-urnas-eletronicas/,FALSO,2021-07-29 07:00:00,,"['Urna eleitoral', 'Máquina de votação', 'Tecnologia', 'Década de 1990', 'Eletrônica', 'Ano', '1990']"
Urnas eletrônicas estão sendo modificadas no Sindicato dos Metalúrgicos de São Bernardo do Campo,Aos Fatos,https://www.aosfatos.org/noticias/urnas-eletronicas-sindicato-dos-metalurgicos-do-abc/,FALSO,2022-09-29 07:00:00,https://encrypted-tbn1.gstatic.com/images?q=tbn:ANd9GcTIgvp78C3yGGuTHiBjhi5Pa05GbpUumWMjipB3QVIk9CQ50pcC,"['Urna eleitoral', 'Urna eletrônica', 'Sindicato dos Metalúrgicos do ABC', 'Sindicato', 'Alterado', 'São Bernardo do Campo']"
Foram encontradas URNAS que já estao contendo VOTOS de CANDIDATOS. O caso foi encaminhado para a POLICIA FEDERAL. ACORDA ELEITOR!,Boatos.org,https://www.boatos.org/politica/urnas-eletronicas-votos-computados-brasilia.html,FALSO,2020-10-21 07:00:00,https://encrypted-tbn1.gstatic.com/images?q=tbn:ANd9GcRsQcOSDKN_NO0QpuXVy95LK9sdtDQhRIFmAtcO04rJX-u83Kpy,"['Urna eleitoral', 'Votação', 'Eleitor', 'Candidato', 'Polícia', 'Departamento de Polícia Federal', 'Polícia Federal']"
"""Em Almeirim a urna está aberta. Vergonha. Pulhas. Anule-se esta votação""",Observador,https://observador.pt/factchecks/fact-check-urnas-abertas-poem-em-risco-votos-antecipados/,FALSO,2021-01-20 08:00:00,https://encrypted-tbn3.gstatic.com/images?q=tbn:ANd9GcQOv_Mheo-5LPg4qYWWsymKcqVbeLWVUBH6sgQDSOE1unX2YU8W,"['Votação', 'Urna eleitoral']"
Urnas autocompletavam o voto em Fernando Haddad,Aos Fatos,https://www.aosfatos.org/noticias/posts-usam-videos-ja-desmentidos-ao-sustentar-que-eleicoes-sao-fraudadas/,FALSO,2021-08-25 07:00:00,https://encrypted-tbn1.gstatic.com/images?q=tbn:ANd9GcSda7KTBhMlUaCNs05heA2ZNV69DGVF9p2yTcFJWt2Z2PyjRlP7,"['Votação', 'Urna eleitoral', 'Fernando Haddad']"
"Caminhão foi flagrado transportando urnas e quem estava transportando era um petista, o que prova fraude.",Aos Fatos,https://www.aosfatos.org/noticias/falso-petista-dono-caminhao-transportou-urnas/,FALSO,2022-11-22 08:00:00,https://encrypted-tbn0.gstatic.com/images?q=tbn:ANd9GcSgVFBdXh64aAth7b3HW8Dur6CRoUovoozbDpfVAHhfY5zi1dBg,"['Urna eleitoral', 'Caminhão', 'Transporte', 'Fraude']"
Urnas eletrônicas não podem ser auditadas,UOL Notícias,https://noticias.uol.com.br/confere/ultimas-noticias/2020/10/10/e-falso-que-urnas-eletronicas-nao-podem-ser-auditadas.htm,FALSO,2020-10-10 07:00:00,https://encrypted-tbn3.gstatic.com/images?q=tbn:ANd9GcSwHqs1zEbZNinoqlMZjdvW9gglO85mh112EMRfT3ZC0l6l_yI3,"['Urna eletrônica', 'Urna eleitoral']"
Urnas eletrônicas de Serafina Corrêa (RS) tinham votos computados para Lula,Aos Fatos,https://www.aosfatos.org/noticias/e-falso-que-urnas-tinham-votos-pre-registrados-para-lula-em-serafina-correa-rs/,FALSO,2022-10-01 07:00:00,https://encrypted-tbn1.gstatic.com/images?q=tbn:ANd9GcRhcwuoKTnOAPCC9fFzJzCWfuiYHfS-BrIMjKekFUS5hyYNcGqK,"['Urna eleitoral', 'Luiz Inácio Lula da Silva', 'Serafina Corrêa', 'Votação', 'Rio Grande do Sul', 'Urna eletrônica']"
Ex-delegado federal Protógenes Queiroz teve que fugir para a Suíça por descobrir fraude nas urnas,UOL Notícias,https://noticias.uol.com.br/confere/ultimas-noticias/2022/06/08/e-falso-que-o-ex-delegado-protogenes-fugiu-para-suica-por-descobrir-fraude.htm,FALSO,2022-06-08 07:00:00,https://encrypted-tbn3.gstatic.com/images?q=tbn:ANd9GcT5FE9vNbPqso0Jb5dOAiKJtZ8JwO419Xvu-cEclkMVndiIH7V6,"['Protógenes Queiroz', 'Fraude', 'Fraude nas urnas eletrônicas', 'Delegado de polícia', 'Urna eleitoral']"
Queixas sobre urnas devem ser reportadas pelo aplicativo Pardal,Aos Fatos,https://www.aosfatos.org/noticias/queixas-sobre-urnas-nao-serao-feitas-pelo-app-pardal-do-tse-em-2022/,FALSO,2022-10-01 07:00:00,https://encrypted-tbn1.gstatic.com/images?q=tbn:ANd9GcRTmHbcZJkkzNaK3RW2TMNbIjmInL7DIudiA6eVHrXxSkO7tFzN,"['Urna eleitoral', 'Aplicativo móvel']"
Modelos anteriores à UE2020 apresentam código incorreto que inviabilizam conferência dos boletins das urnas,Aos Fatos,https://www.aosfatos.org/noticias/relatorio-pl-tse-bolsonaro-segundo-turno/,FALSO,2022-11-22 08:00:00,https://encrypted-tbn0.gstatic.com/images?q=tbn:ANd9GcRi1kq-byYNfW8HJKQc8Xtf0sIuqD-Th3CdaVZDTldOzMA482GD,['Urna eleitoral']
Este vídeo prova que nova funcionalidade das urnas pode anular voto de eleitores,AFP Checamos,https://checamos.afp.com/doc.afp.com.32KC2CF,FALSO,2022-09-29 07:00:00,https://encrypted-tbn1.gstatic.com/images?q=tbn:ANd9GcQvh2RdDq7-gLmBrKH8LrcOFwGYhgB53pIpvC8W1k-YmOV6lizk,"['Votação', 'Urna eleitoral', 'Eleição', 'Vídeo']"
Distribuição de urnas pela Comlurb comprova fraude nas eleições,Aosfatos.org,https://www.aosfatos.org/noticias/video-que-mostra-garis-entregando-urnas-no-rj-e-de-2018-e-nao-prova-fraude/,FALSO,2022-09-22 07:00:00,https://encrypted-tbn0.gstatic.com/images?q=tbn:ANd9GcS7225NQw6fXQk9JXWQM8kFWyWwU0u0uz9qy2C9zEsIbLTC7ydB,"['Urna eleitoral', 'Fraude', 'Eleição', 'Comlurb']"
Em 2022 número de urnas enviadas ao exterior diminuiu enquanto as dos presídios aumentou,AFP Checamos,https://checamos.afp.com/doc.afp.com.32KJ4JP,FALSO,2022-10-02 07:00:00,https://encrypted-tbn0.gstatic.com/images?q=tbn:ANd9GcSRZXiW5tH3I2BNKeZ8Tiw3Y3defsibDh9FgSlCx_BdvqQQWJSL,"['Urna eleitoral', '2022', 'Número']"
Votação pela urna eletrônica pode ser manipulada via internet,BOL - UOL,https://www.bol.uol.com.br/noticias/2021/07/17/votacao-urna-eletronica-internet-hacker.htm,FALSO,2021-07-17 07:00:00,https://encrypted-tbn3.gstatic.com/images?q=tbn:ANd9GcQjEx8DCZv21xr7Lyz2y43HsFl6VMz3e1x0e0enYKKdY6HMEJfS,"['Máquina de votação', 'Votação', 'Urna eleitoral', 'Eletrônica', 'Internet']"
"Apenas Brasil, Venezuela e Cuba utilizam urnas eletrônicas nas eleições",Aos Fatos,https://www.aosfatos.org/noticias/brasil-venezuela-cuba-unicos-paises-urna-eletronica/,FALSO,2020-10-08 07:00:00,https://encrypted-tbn2.gstatic.com/images?q=tbn:ANd9GcQ68HcUnUGcWX3CLkX8VHUN6C1KruR4K5xgUwnxDzQL4j-8rWjp,"['Urna eleitoral', 'Cuba', 'Venezuela', 'Brasil', 'Eleição', 'Urna eletrônica']"
ROUBO DE URNAS EM FORTALEZA/CE – 2 caba de amarelo (cor da campanha do poste dos Gomes) pegaram um monte de urna e já iam saindo de finim. Prestou não!,Boatos.org,https://www.boatos.org/politica/caminhao-rouba-urnas-fortaleza-fraude-eleicoes-2020.html,FALSO,2020-11-23 08:00:00,https://encrypted-tbn2.gstatic.com/images?q=tbn:ANd9GcTqli9F6-plcxpE0JM3j4m6WI1YB5gVZ1gQGbvKj_c5T0U-nIBH,"['Urna eleitoral', 'Fortaleza', 'Ceará', 'Roubo', 'Cor', 'Amarelo']"
Alexandre de Moraes disse que quem reclamar das urnas será preso,Projeto Comprova,https://projetocomprova.com.br/publica%C3%A7%C3%B5es/moraes-nao-disse-que-vai-mandar-prender-eleitor-que-reclamar-das-urnas/,FALSO,2022-10-02 07:00:00,,"['Alexandre de Moraes', 'Urna eleitoral', 'Prisão']"
URGENTE: UMA BOMBA VAI ESTOURAR. O Presidente Bolsonaro vai provar que houve FRAUDE nas urnas Eleitorais!,Boatos.org,https://www.boatos.org/politica/bolsonaro-vai-provar-amanha-19h-houve-fraude-eleicoes.html,FALSO,2022-11-10 08:00:00,https://encrypted-tbn3.gstatic.com/images?q=tbn:ANd9GcQeZpaigOpOADvVah7FNWm90wr3ytAY0gCkrQPqwvwvGAs5HRqR,"['Jair Bolsonaro', 'Fraude', 'Fraude nas urnas eletrônicas', 'Eleição', 'Presidente', 'Urna eleitoral']"
Boletins de Urna com mais votos para Bolsonaro do que para Lula comprovam fraude em Minas Gerais,Projeto Comprova,https://projetocomprova.com.br/publica%C3%A7%C3%B5es/video-de-boletins-de-urnas-que-mostram-bolsonaro-com-mais-votos-do-que-lula-nao-prova-fraude/,FALSO,2022-10-14 07:00:00,,"['Jair Bolsonaro', 'Luiz Inácio Lula da Silva', 'Urna eleitoral', 'Votação', 'Fraude', 'Minas Gerais']"
Número de urna de Carlos Bolsonaro não aparece ao votar no Rio,UOL Notícias,https://noticias.uol.com.br/confere/ultimas-noticias/2020/11/15/e-falsa-postagem-que-diz-ter-digitado-numero-de-carluxo-e-dado-inexistente.htm,FALSO,2020-11-15 08:00:00,https://encrypted-tbn2.gstatic.com/images?q=tbn:ANd9GcQKXYtMKhUaKwZwdgsTPwxNm-zkhU5HE5VY1JjHcm2VUFYucX2W,"['Carlos Bolsonaro', 'Votação', 'Número', 'Urna eleitoral', 'Rio de Janeiro']"
"Vídeo alegando falsamente que 70% do processo eleitoral seria terceirizado, incluindo a contagem dos votos, com o intuito de associar a terceirização a um suposto comprometimento da integridade das eleições. O conteúdo ainda promove desinformação sobre as funções exercidas por empresas e, em especial, técnicos de urna terceirizados que prestam serviços à Justiça Eleitoral, assim como sobre a credibilidade de algumas das entidades privadas que tiveram contratos com o TSE ou com os TREs.",Folha - UOL,https://www1.folha.uol.com.br/poder/2022/09/e-falso-que-70-do-processo-eleitoral-seja-terceirizado.shtml,FALSO,2022-09-28 07:00:00,https://encrypted-tbn1.gstatic.com/images?q=tbn:ANd9GcT8h9DNlT8tC5UcLQVU-4D1YdIXGVnmwUMrqQ8-isKHUBvnPLtL,"['Eleição', 'Terceirização', 'Votação', 'Tribunal Superior Eleitoral', 'Urna eleitoral', 'Serviço', 'Contrato']"
"De 2023 até agora, já entraram 811 mil chineses no Brasil",Estadão,https://www.estadao.com.br/estadao-verifica/811-mil-chineses-brasil-titulo-de-eleitor/,FALSO,2026-04-16 21:20:49,https://encrypted-tbn0.gstatic.com/images?q=tbn:ANd9GcTTts2u45OaNU1NEKNPBWRDOeoBp__bqu3smAmkwbkN5H8cI99b,"['Brasil', '2023']"
"""Maçonaria apela ao voto em António José Seguro""",Observador,https://observador.pt/factchecks/fact-check-noticia-sobre-apoio-da-maconaria-a-antonio-jose-seguro-e-verdadeira/,FALSO,,https://encrypted-tbn3.gstatic.com/images?q=tbn:ANd9GcSPoSTekUtgc_77fQoKLZVgRXrfRC2VlIfGvKU-4cRTmZlv5x96,"['António José Seguro', 'Maçonaria', 'Votação']"
"Caras de Passos, Ronaldo, Herman, Lili Caneças e Jorge Jesus com o slogan: ""Eu voto Ventura""",Observador,https://observador.pt/factchecks/fact-check-passos-ronaldo-herman-jose-e-lili-canecas-anunciaram-voto-em-andre-ventura/,FALSO,2026-01-26 08:00:00,https://encrypted-tbn3.gstatic.com/images?q=tbn:ANd9GcSPoSTekUtgc_77fQoKLZVgRXrfRC2VlIfGvKU-4cRTmZlv5x96,"['André Ventura', 'Votação', 'Herman José', 'Lili Caneças', 'Cristiano Ronaldo', 'Jorge Jesus', 'Slogan', 'Caras']"
Nikolas Ferreira votou contra isenção do imposto de renda para quem recebe até R$ 5 mil,Estadão,https://www.estadao.com.br/estadao-verifica/falso-nikolas-ferreira-votou-contra-isencao-imposto-de-renda/,FALSO,2026-01-16 08:00:00,https://encrypted-tbn1.gstatic.com/images?q=tbn:ANd9GcQP4BXxnM-ovNFyNgWX6b2zv4QH_w13xjVApV-TzxyBGa8cnvcV,"['Nikolas Ferreira', 'Imposto de renda', 'Imposto', 'Isenção fiscal', 'Renda']"
Fux acaba de votar para inocentar Bolsonaro,UOL Notícias,https://noticias.uol.com.br/confere/ultimas-noticias/2025/10/30/falso-video-nikolas-ferreira-voto-fux-libertacao-bolsonaro.htm,FALSO,2025-10-30 07:00:00,https://encrypted-tbn1.gstatic.com/images?q=tbn:ANd9GcQgt1n6w3KCitPrCIbKAC6Mc0HBdmo7ZNUG_SIbvxMeOQ4YgwNY,"['Jair Bolsonaro', 'Luiz Fux', 'Votação']"
Voto de Fux remete processo de Bolsonaro para a primeira instância,Aos Fatos,https://www.aosfatos.org/noticias/voto-de-fux-nao-remeteu-processo-de-bolsonaro-a-primeira-instancia/,FALSO,2025-09-11 07:00:00,https://encrypted-tbn3.gstatic.com/images?q=tbn:ANd9GcRyMc0Wm_oXQyXOgDxhpM2de3CHNJ--YqShRgOYINqR-gInbj2F,"['Luiz Fux', 'Jair Bolsonaro', 'Primeira instância', 'Processo judicial', 'Votação']"
